{
  "schema_version": "axiom.migration_plan.v1",
  "ok": true,
  "command": "migrate",
  "mode": "plan-only",
  "source": {
    "schema_version": "axiom.compatibility_report.v1",
    "old_contract": "axiom://compatibility/migration-plan-scenario/old",
    "new_contract": "axiom://compatibility/migration-plan-scenario/new"
  },
  "editions": {
    "from": "2026",
    "to": "2026"
  },
  "actions": [
    {
      "sequence": 1,
      "id": "breaking:axiom://cli/check",
      "kind": "breaking",
      "severity": "breaking",
      "surface_kind": "cli",
      "surface_id": "axiom://cli/check",
      "instruction": "Keep --json and add --properties --backend when running property fixtures.",
      "replacement": null
    },
    {
      "sequence": 2,
      "id": "deprecated:axiom://stdlib/text/lines",
      "kind": "deprecated",
      "severity": "deprecated",
      "surface_kind": "stdlib",
      "surface_id": "axiom://stdlib/text/lines",
      "instruction": "Replace text.lines with text.split_lines before removal.",
      "replacement": "axiom://stdlib/text/split-lines"
    },
    {
      "sequence": 3,
      "id": "replacement:axiom://stdlib/text/lines",
      "kind": "replacement",
      "severity": "deprecated",
      "surface_kind": "stdlib",
      "surface_id": "axiom://stdlib/text/lines",
      "instruction": "Replace axiom://stdlib/text/lines with axiom://stdlib/text/split-lines.",
      "replacement": "axiom://stdlib/text/split-lines"
    }
  ],
  "effects": {
    "source_rewriting": false,
    "package_resolution": false,
    "release_publication": false,
    "policy_changes": false
  }
}
